{
  "vector_id": "language-unicode-v1-001",
  "kind": "language_unicode_v1",
  "protocol_version": "0.1.0",
  "registry_lock": {
    "language_subtag_registry": {
      "path": "assets/registry/iana-language-subtag-registry-2026-08-08.txt",
      "file_date": "2026-08-08",
      "byte_length": 731799,
      "sha256_raw": "sha256:be21e91b6851f750a7b1a687f11209d46ad5a8471d6b10a1efc8d1dac4c8a926"
    },
    "language_tag_extensions_registry": {
      "path": "assets/registry/iana-language-tag-extensions-registry-2014-04-02.txt",
      "file_date": "2014-04-02",
      "byte_length": 1069,
      "sha256_raw": "sha256:fdf7764455c493c245a9b3b5b9cd3938391f0637302c3e943fde86aee652e376"
    }
  },
  "unicode_runtime": {
    "version": "15.1.0",
    "normalization_scope": "NFC_AND_NFKC_VECTOR_CASES_ONLY",
    "bidi_detection_scope": "CODEPOINT_PRESENCE_ONLY"
  },
  "bcp47_cases": [
    {
      "case_id": "registered_language",
      "input": "en",
      "expected": {
        "valid": true,
        "classification": "REGISTERED",
        "canonical": "en",
        "deprecated": false,
        "preferred_value": null,
        "error_code": null
      }
    },
    {
      "case_id": "canonical_case",
      "input": "EN-us",
      "expected": {
        "valid": true,
        "classification": "REGISTERED",
        "canonical": "en-US",
        "deprecated": false,
        "preferred_value": null,
        "error_code": null
      }
    },
    {
      "case_id": "deprecated_language",
      "input": "iw",
      "expected": {
        "valid": true,
        "classification": "DEPRECATED",
        "canonical": "he",
        "deprecated": true,
        "preferred_value": "he",
        "error_code": null
      }
    },
    {
      "case_id": "deprecated_region",
      "input": "my-BU",
      "expected": {
        "valid": true,
        "classification": "DEPRECATED",
        "canonical": "my-MM",
        "deprecated": true,
        "preferred_value": "my-MM",
        "error_code": null
      }
    },
    {
      "case_id": "deprecated_redundant_precedence",
      "input": "zh-cmn-Hans",
      "expected": {
        "valid": true,
        "classification": "DEPRECATED",
        "canonical": "cmn-Hans",
        "deprecated": true,
        "preferred_value": "cmn-Hans",
        "error_code": null
      }
    },
    {
      "case_id": "deprecated_redundant_sign_language",
      "input": "sgn-BR",
      "expected": {
        "valid": true,
        "classification": "DEPRECATED",
        "canonical": "bzs",
        "deprecated": true,
        "preferred_value": "bzs",
        "error_code": null
      }
    },
    {
      "case_id": "grandfathered_deprecated",
      "input": "i-klingon",
      "expected": {
        "valid": true,
        "classification": "GRANDFATHERED_DEPRECATED",
        "canonical": "tlh",
        "deprecated": true,
        "preferred_value": "tlh",
        "error_code": null
      }
    },
    {
      "case_id": "grandfathered_current",
      "input": "i-default",
      "expected": {
        "valid": true,
        "classification": "GRANDFATHERED",
        "canonical": "i-default",
        "deprecated": false,
        "preferred_value": null,
        "error_code": null
      }
    },
    {
      "case_id": "registered_extension",
      "input": "en-US-u-ca-gregory",
      "expected": {
        "valid": true,
        "classification": "EXTENSION",
        "canonical": "en-US-u-ca-gregory",
        "deprecated": false,
        "preferred_value": null,
        "error_code": null
      }
    },
    {
      "case_id": "registered_transformed_extension",
      "input": "en-t-it",
      "expected": {
        "valid": true,
        "classification": "EXTENSION",
        "canonical": "en-t-it",
        "deprecated": false,
        "preferred_value": null,
        "error_code": null
      }
    },
    {
      "case_id": "extension_singleton_canonical_order",
      "input": "en-u-ca-gregory-t-it",
      "expected": {
        "valid": true,
        "classification": "EXTENSION",
        "canonical": "en-t-it-u-ca-gregory",
        "deprecated": false,
        "preferred_value": null,
        "error_code": null
      }
    },
    {
      "case_id": "private_use",
      "input": "x-acme-private",
      "expected": {
        "valid": true,
        "classification": "PRIVATE_USE",
        "canonical": "x-acme-private",
        "deprecated": false,
        "preferred_value": null,
        "error_code": null
      }
    },
    {
      "case_id": "unregistered_variant",
      "input": "en-abcdef",
      "expected": {
        "valid": false,
        "classification": "INVALID",
        "canonical": null,
        "deprecated": false,
        "preferred_value": null,
        "error_code": "UNREGISTERED_SUBTAG"
      }
    },
    {
      "case_id": "unregistered_language",
      "input": "zzzz",
      "expected": {
        "valid": false,
        "classification": "INVALID",
        "canonical": null,
        "deprecated": false,
        "preferred_value": null,
        "error_code": "UNREGISTERED_SUBTAG"
      }
    },
    {
      "case_id": "variant_prefix_is_advisory",
      "input": "is-1994",
      "expected": {
        "valid": true,
        "classification": "REGISTERED",
        "canonical": "is-1994",
        "deprecated": false,
        "preferred_value": null,
        "error_code": null
      }
    },
    {
      "case_id": "variant_prefix_with_script",
      "input": "sl-Latn-rozaj-biske",
      "expected": {
        "valid": true,
        "classification": "REGISTERED",
        "canonical": "sl-Latn-rozaj-biske",
        "deprecated": false,
        "preferred_value": null,
        "error_code": null
      }
    },
    {
      "case_id": "extlang_prefix_is_required",
      "input": "en-cmn",
      "expected": {
        "valid": false,
        "classification": "INVALID",
        "canonical": null,
        "deprecated": false,
        "preferred_value": null,
        "error_code": "EXTLANG_PREFIX"
      }
    },
    {
      "case_id": "invalid_subtag_order",
      "input": "en-US-Latn",
      "expected": {
        "valid": false,
        "classification": "INVALID",
        "canonical": null,
        "deprecated": false,
        "preferred_value": null,
        "error_code": "ORDER"
      }
    },
    {
      "case_id": "duplicate_variant",
      "input": "sl-rozaj-rozaj",
      "expected": {
        "valid": false,
        "classification": "INVALID",
        "canonical": null,
        "deprecated": false,
        "preferred_value": null,
        "error_code": "DUPLICATE_VARIANT"
      }
    },
    {
      "case_id": "duplicate_extension_singleton",
      "input": "en-u-ca-gregory-u-nu-latn",
      "expected": {
        "valid": false,
        "classification": "INVALID",
        "canonical": null,
        "deprecated": false,
        "preferred_value": null,
        "error_code": "DUPLICATE_SINGLETON"
      }
    },
    {
      "case_id": "unregistered_extension_singleton",
      "input": "en-a-foo",
      "expected": {
        "valid": false,
        "classification": "INVALID",
        "canonical": null,
        "deprecated": false,
        "preferred_value": null,
        "error_code": "UNREGISTERED_SINGLETON"
      }
    },
    {
      "case_id": "empty_subtag",
      "input": "en--US",
      "expected": {
        "valid": false,
        "classification": "INVALID",
        "canonical": null,
        "deprecated": false,
        "preferred_value": null,
        "error_code": "SYNTAX"
      }
    }
  ],
  "unicode_cases": {
    "normalization": [
      {
        "case_id": "nfc_composes_e_acute",
        "input": "é",
        "operation": "NFC",
        "expected": "é",
        "nfkc_expected": "é"
      },
      {
        "case_id": "nfc_preserves_fullwidth_a",
        "input": "Ａ",
        "operation": "NFC",
        "expected": "Ａ",
        "nfkc_expected": "A"
      },
      {
        "case_id": "nfc_preserves_ligature_ffi",
        "input": "ﬃ",
        "operation": "NFC",
        "expected": "ﬃ",
        "nfkc_expected": "ffi"
      }
    ],
    "source_byte_preservation": [
      {
        "case_id": "source_nfd_e_acute",
        "source_utf8_hex": "65cc81",
        "expected_source_utf8_hex": "65cc81",
        "derived_nfc_utf8_hex": "c3a9"
      },
      {
        "case_id": "source_fullwidth_a",
        "source_utf8_hex": "efbca1",
        "expected_source_utf8_hex": "efbca1",
        "derived_nfc_utf8_hex": "efbca1"
      }
    ],
    "protected_spans": [
      {
        "case_id": "protected_fullwidth_amount",
        "category": "number_or_unit",
        "input": "ＵＳＤ １,０００",
        "expected": "ＵＳＤ １,０００"
      },
      {
        "case_id": "protected_code_nfd",
        "category": "code",
        "input": "const key = \"é\";",
        "expected": "const key = \"é\";"
      }
    ],
    "bidi_control_detection": [
      {
        "case_id": "rlo_pdf_detected",
        "input": "abc‮txt‬",
        "detected": true,
        "control_codepoints": [
          "U+202E",
          "U+202C"
        ],
        "expected_unchanged": "abc‮txt‬"
      },
      {
        "case_id": "lri_pdi_detected",
        "input": "abc⁦RTL⁩",
        "detected": true,
        "control_codepoints": [
          "U+2066",
          "U+2069"
        ],
        "expected_unchanged": "abc⁦RTL⁩"
      },
      {
        "case_id": "no_bidi_control",
        "input": "مرحبا world",
        "detected": false,
        "control_codepoints": [],
        "expected_unchanged": "مرحبا world"
      }
    ]
  },
  "not_claimed": [
    {
      "algorithm": "UAX9",
      "result": "NOT_RUN"
    },
    {
      "algorithm": "UAX29",
      "result": "NOT_RUN"
    },
    {
      "algorithm": "UTS39",
      "result": "NOT_RUN"
    },
    {
      "algorithm": "PACKAGE_CONTENT_NORMALIZATION",
      "result": "NOT_RUN"
    },
    {
      "algorithm": "PACKAGE_PROTECTED_SPAN_PRESERVATION",
      "result": "NOT_RUN"
    },
    {